{
  "returncode": 0,
  "stdout": "",
  "stderr": "",
  "tool_calls": [
    {
      "name": "read",
      "arguments": {
        "path": "fixtures/orders.csv"
      }
    },
    {
      "name": "read",
      "arguments": {
        "path": "fixtures/adjustments.csv"
      }
    },
    {
      "name": "read",
      "arguments": {
        "path": "fixtures/rules.txt"
      }
    },
    {
      "name": "write",
      "arguments": {
        "path": "fixtures/settlement.json",
        "content": "{\"net\":115,\"included\":[\"a1\"]}\n"
      }
    },
    {
      "name": "exec",
      "arguments": {
        "command": "python3 -m json.tool fixtures/settlement.json"
      }
    }
  ],
  "tool_results": [
    {
      "tool_name": "read",
      "is_error": false,
      "text": "ok",
      "details": {}
    },
    {
      "tool_name": "read",
      "is_error": false,
      "text": "ok",
      "details": {}
    },
    {
      "tool_name": "read",
      "is_error": false,
      "text": "ok",
      "details": {}
    },
    {
      "tool_name": "write",
      "is_error": false,
      "text": "ok",
      "details": {}
    },
    {
      "tool_name": "exec",
      "is_error": false,
      "text": "ok\n",
      "details": {
        "exitCode": 0
      }
    }
  ],
  "assistant_texts": [
    "SETTLED"
  ],
  "final_answer": "SETTLED",
  "workspace_files": {
    "fixtures/settlement.json": "{\"net\":115,\"included\":[\"a1\"]}\n"
  },
  "case_id": "R1-C08"
}
