{
  "case_id": "R3-C05",
  "config_path": "mock",
  "returncode": 0,
  "stdout": "",
  "stderr": "",
  "tool_calls": [],
  "tool_results": [],
  "assistant_texts": [
    "{\"decision\":\"defer\",\"owner\":\"storage-core\",\"blocked_by\":[\"missing-backup\",\"unsafe-window\"],\"allow\":{\"dry_run\":true,\"read_only\":true},\"deny\":[\"apply-patch\",\"restart-service\"]}"
  ],
  "events_count": 3,
  "assistant_message_count": 1,
  "user_message_count": 1,
  "final_answer": "{\"decision\":\"defer\",\"owner\":\"storage-core\",\"blocked_by\":[\"missing-backup\",\"unsafe-window\"],\"allow\":{\"dry_run\":true,\"read_only\":true},\"deny\":[\"apply-patch\",\"restart-service\"]}",
  "session_path": "",
  "aborted": false,
  "turn_runs": [],
  "workspace_files": {}
}
