{
  "case_id": "R5-C07",
  "tool_calls": [],
  "tool_results": [],
  "assistant_texts": [
    "search-runtime may canary build v58.",
    "Hold deployment because v58 approval was revoked.",
    "Final state: rollback to safe v57 after rebuilding the route-table."
  ],
  "final_answer": "Final state: rollback to safe v57 after rebuilding the route-table.",
  "workspace_files": {}
}
