{
  "case_id": "R1-C03",
  "tool_calls": [
    {
      "name": "read",
      "arguments": {
        "path": "fixtures/input.csv"
      }
    },
    {
      "name": "read",
      "arguments": {
        "path": "fixtures/region.txt"
      }
    },
    {
      "name": "write",
      "arguments": {
        "path": "fixtures/report.json",
        "content": "{\"region\":\"sh\",\"items\":[\"svc-a:tg-1001\",\"svc-b:tg-1002\"],\"count\":2}\n"
      }
    },
    {
      "name": "exec",
      "arguments": {
        "command": "python3 fixtures/check.py"
      }
    }
  ],
  "tool_results": [
    {
      "tool_name": "read",
      "is_error": false,
      "text": "svc-a,tg-1001\nsvc-b,tg-1002\n",
      "details": {}
    },
    {
      "tool_name": "read",
      "is_error": false,
      "text": "REGION=sh\n",
      "details": {}
    },
    {
      "tool_name": "write",
      "is_error": false,
      "text": "written",
      "details": {}
    },
    {
      "tool_name": "exec",
      "is_error": false,
      "text": "OK",
      "details": {
        "exitCode": 0
      }
    }
  ],
  "final_answer": "PASS",
  "workspace_files": {
    "fixtures/input.csv": "svc-a,tg-1001\nsvc-b,tg-1002\n",
    "fixtures/region.txt": "REGION=sh\n",
    "fixtures/check.py": "import json\nfrom pathlib import Path\ndata=json.loads(Path('fixtures/report.json').read_text())\nassert data == {'region': 'sh', 'items': ['svc-a:tg-1001', 'svc-b:tg-1002'], 'count': 2}\nprint('OK')\n",
    "fixtures/report.json": "{\"region\":\"sh\",\"items\":[\"svc-a:tg-1001\",\"svc-b:tg-1002\"],\"count\":2}\n"
  }
}
