{
  "returncode": 0,
  "stdout": "",
  "stderr": "",
  "tool_calls": [
    {
      "name": "read",
      "arguments": {
        "path": "fixtures/base.txt"
      }
    },
    {
      "name": "read",
      "arguments": {
        "path": "fixtures/override.txt"
      }
    },
    {
      "name": "read",
      "arguments": {
        "path": "fixtures/retraction.txt"
      }
    }
  ],
  "tool_results": [
    {
      "tool_name": "read",
      "is_error": false,
      "text": "ok",
      "details": {}
    },
    {
      "tool_name": "read",
      "is_error": false,
      "text": "ok",
      "details": {}
    },
    {
      "tool_name": "read",
      "is_error": false,
      "text": "ok",
      "details": {}
    }
  ],
  "assistant_texts": [
    "atlas"
  ],
  "final_answer": "atlas",
  "workspace_files": {},
  "case_id": "R2-C06"
}
